{
  "$schema": "https://json-schema.org/draft/2020-12/schema",
  "$id": "https://dcp-ai.org/schemas/v2/intent.schema.json",
  "title": "IntentDeclarationV2",
  "description": "DCP v2.0 Intent Declaration. Session-bound with composite signature via SignedPayload.",
  "type": "object",
  "additionalProperties": false,
  "required": [
    "dcp_version", "intent_id", "session_nonce", "agent_id", "human_id",
    "timestamp", "action_type", "target", "data_classes",
    "estimated_impact", "requires_consent"
  ],
  "properties": {
    "dcp_version": {
      "type": "string",
      "const": "2.0"
    },
    "intent_id": {
      "type": "string",
      "minLength": 6
    },
    "session_nonce": {
      "type": "string",
      "pattern": "^[0-9a-f]{64}$"
    },
    "agent_id": {
      "type": "string",
      "minLength": 6
    },
    "human_id": {
      "type": "string",
      "minLength": 6
    },
    "timestamp": {
      "type": "string",
      "format": "date-time"
    },
    "action_type": {
      "type": "string",
      "enum": [
        "browse", "api_call", "send_email", "create_calendar_event",
        "initiate_payment", "update_crm", "write_file", "execute_code"
      ]
    },
    "target": {
      "type": "object",
      "required": ["channel"],
      "properties": {
        "channel": {
          "type": "string",
          "enum": ["web", "api", "email", "calendar", "payments", "crm", "filesystem", "runtime"]
        },
        "to": { "type": ["string", "null"] },
        "domain": { "type": ["string", "null"] },
        "url": { "type": ["string", "null"] }
      }
    },
    "data_classes": {
      "type": "array",
      "items": {
        "type": "string",
        "enum": [
          "none", "contact_info", "pii", "credentials",
          "financial_data", "health_data", "children_data", "company_confidential"
        ]
      }
    },
    "estimated_impact": {
      "type": "string",
      "enum": ["low", "medium", "high"]
    },
    "requires_consent": {
      "type": "boolean"
    },
    "security_tier": {
      "type": "string",
      "enum": ["routine", "standard", "elevated", "maximum"],
      "description": "Cryptographic security tier, auto-computed or explicitly set"
    }
  }
}
