{
  "dcp_version": "2.0",
  "intent_id": "intent:v2-email-gen-001",
  "session_nonce": "a0f170f5da399c85fb454c1194b0650475d3b55e2068eaafe263cf4aa90630c8",
  "agent_id": "agent:research-bot-v2-gen",
  "human_id": "rpr:v2-example-001",
  "timestamp": "2026-03-01T12:00:00Z",
  "action_type": "send_email",
  "target": {
    "channel": "email",
    "to": "bob@example.com",
    "domain": "example.com"
  },
  "data_classes": [
    "contact_info"
  ],
  "estimated_impact": "low",
  "requires_consent": false,
  "security_tier": "standard"
}